{
  "source_id": "owasp-asvs",
  "role": "security",
  "source_url": "https://owasp.org/www-project-application-security-verification-standard/",
  "final_url": "https://owasp.org/www-project-application-security-verification-standard/",
  "authority": "primary",
  "retrieved_at": "2026-08-11T12:14:44.762Z",
  "content_sha256": "4c8406d61c8c37fbdef39787a99d2c149a3569ea5699b83c48e663b7928a3d4a",
  "metadata_sha256": "077270ba68462fb75e07d0c8f1291b26fe9b041cdf978e46df1b4a27ac68972a",
  "http_status": 200,
  "title": "OWASP Application Security Verification Standard (ASVS) | OWASP Foundation",
  "description": "The OWASP Application Security Verification Standard (ASVS) Project is a framework of security requirements that focus on defining the security controls required when designing, developing and testing modern web applications and web services.",
  "headings": [
    "OWASP Application Security Verification Standard (ASVS)",
    "What is the ASVS?",
    "Support the ASVS",
    "Stay up to date with the ASVS",
    "More Details on the ASVS",
    "How To Reference ASVS Requirements",
    "Related Projects",
    "Example",
    "Jump to an event",
    "Meet the ASVS team at Global AppSec San Francisco 2024",
    "Get updated on the ASVS",
    "Hear about using the ASVS",
    "Engage with the Community",
    "We hope to see you there at Global AppSec San Francisco 2024",
    "OWASP ASVS Community Meetup - Lisbon 2024",
    "Full Agenda",
    "Meetup Supporter",
    "ASVS Supporters",
    "Introduction",
    "Maintaining Supporters (through time provision)",
    "Primary supporters",
    "Secondary supporters",
    "Tertiary supporters",
    "Associate supporters",
    "News and Events",
    "Acknowledgements",
    "Volunteers",
    "Version 3 (2015)",
    "Version 2 (2014)",
    "Version 2009",
    "OWASP Summer of Code 2008",
    "Volunteer for the ASVS",
    "Building the standard",
    "Helping in other ways",
    "ASVS Users",
    "CREST OWASP Verification Standard (OVS) Programme",
    "App Defense Alliance",
    "Other users",
    "Source in GitHub",
    "Downloads (ASVS 5.0.0)"
  ],
  "redirect_hops": [
    "https://owasp.org/www-project-application-security-verification-standard/"
  ],
  "storage_mode": "metadata-only",
  "body_stored": false,
  "trust": "untrusted-external-data"
}
