{
  "source_id": "wcag-22",
  "role": "design",
  "source_url": "https://www.w3.org/TR/WCAG22/",
  "final_url": "https://www.w3.org/TR/WCAG22/",
  "authority": "primary",
  "retrieved_at": "2026-08-23T18:49:15.942Z",
  "content_sha256": "64fd73cdb7725d9511488f5de6386081329d365872547b2d5000ef771ac37bd0",
  "metadata_sha256": "1cc56727c4bc55fa729a17d1600a0cde6d5192c7005da0cb7831a93023e0e486",
  "http_status": 200,
  "title": "Web Content Accessibility Guidelines (WCAG) 2.2",
  "description": "Web Content Accessibility Guidelines (WCAG) 2.2 covers a wide range of recommendations for making web content more accessible. Following these guidelines will make content more accessible to a wider range of people with disabilities, including accommodations for blindness and low vision, deafness and hearing loss, limited movement, speech disabilities, photosensitivity, and combinations of these, and some accommodation for learning disabilities and cognitive limitations; but will not address every user need for people with these disabilities. These guidelines address accessibility of web content on any kind of device (including desktops, laptops, kiosks, and mobile devices). Following these guidelines will also often make web content more usable to users in general.",
  "headings": [
    "Web Content Accessibility Guidelines (WCAG) 2.2",
    "Abstract",
    "Status of This Document",
    "Table of Contents",
    "Introduction",
    "Background on WCAG 2",
    "WCAG 2 Layers of Guidance",
    "WCAG 2.2 Supporting Documents",
    "Requirements for WCAG 2.2",
    "Comparison with WCAG 2.1",
    "Later Versions of Accessibility Guidelines",
    "1. Perceivable",
    "Guideline 1.1 Text Alternatives",
    "Guideline 1.2 Time-based Media",
    "Guideline 1.3 Adaptable",
    "Guideline 1.4 Distinguishable",
    "2. Operable",
    "Guideline 2.1 Keyboard Accessible",
    "Guideline 2.2 Enough Time",
    "Guideline 2.3 Seizures and Physical Reactions",
    "Guideline 2.4 Navigable",
    "Guideline 2.5 Input Modalities",
    "3. Understandable",
    "Guideline 3.1 Readable",
    "Guideline 3.2 Predictable",
    "Guideline 3.3 Input Assistance",
    "4. Robust",
    "Guideline 4.1 Compatible",
    "5. Conformance",
    "5.1 Interpreting Normative Requirements",
    "5.2 Conformance Requirements",
    "5.3 Conformance Claims (Optional)",
    "5.4 Statement of Partial Conformance - Third Party Content",
    "5.5 Statement of Partial Conformance - Language",
    "5.6 Privacy Considerations",
    "5.7 Security Considerations",
    "6. Glossary",
    "7. Input Purposes for User Interface Components",
    "A. Change Log",
    "B. Acknowledgments"
  ],
  "redirect_hops": [
    "https://www.w3.org/TR/WCAG22/"
  ],
  "storage_mode": "metadata-only",
  "body_stored": false,
  "trust": "untrusted-external-data"
}
