{
  "source_id": "next-server-actions",
  "role": "backend",
  "source_url": "https://nextjs.org/docs/app/guides/server-actions",
  "final_url": "https://nextjs.org/docs/app/guides/server-actions",
  "authority": "primary",
  "retrieved_at": "2026-08-19T06:47:32.904Z",
  "content_sha256": "89dfdb8dcc184a9fdcc9a549491f4b6e76f032d1602d19c90e853e1e16fa378a",
  "metadata_sha256": "9829c2bdc8bed6053730f42c6dbcd73a0632f9f757e744408c4fdb3228d77a78",
  "http_status": 200,
  "title": "Guides: Server Actions | Next.js",
  "description": "How Server Actions work in Next.js, including the single-roundtrip response model, sequential dispatch, security, and caching integration.",
  "headings": [
    "Server Actions and Mutations",
    "Sequential dispatch on the client",
    "A single response carries data and UI",
    "Security",
    "Choosing a cache update",
    "Configuration",
    "Deployment considerations",
    "Next steps",
    "Mutating Data",
    "Forms",
    "Data Security",
    "use server",
    "revalidatePath",
    "revalidateTag",
    "redirect",
    "refresh",
    "serverActions"
  ],
  "redirect_hops": [
    "https://nextjs.org/docs/app/guides/server-actions"
  ],
  "storage_mode": "metadata-only",
  "body_stored": false,
  "trust": "untrusted-external-data"
}
