{
  "source_id": "github-actions-security",
  "role": "platform",
  "source_url": "https://docs.github.com/en/actions/security-for-github-actions/security-guides/security-hardening-for-github-actions",
  "final_url": "https://docs.github.com/en/actions/reference/security/secure-use",
  "authority": "primary",
  "retrieved_at": "2026-08-15T18:47:47.439Z",
  "content_sha256": "66741fec3093ed843faef89cedbf26803184045b782b1154e464c62ca22c3c50",
  "metadata_sha256": "6bbca9162fbf10f674b6bd08daf120aa77aba71ac26e26749d70ee3ddcdf8d39",
  "http_status": 200,
  "title": "Secure use reference - GitHub Docs",
  "description": "Security practices for writing workflows and using GitHub Actions features.",
  "headings": [
    "GitHub Actions",
    "Secure use reference",
    "In this article",
    "Writing workflows",
    "Use secrets for sensitive information",
    "Good practices for mitigating script injection attacks",
    "Mitigating the risks of untrusted code checkout",
    "Good practices",
    "Using third-party actions",
    "Reusing third-party workflows",
    "GitHub&#x27;s security features",
    "Using CODEOWNERS to monitor changes",
    "Using OpenID Connect to access cloud resources",
    "Using Dependabot version updates to keep actions up to date",
    "Preventing GitHub Actions from creating or approving pull requests",
    "Using code scanning to secure workflows",
    "Using OpenSSF Scorecards to secure workflow dependencies",
    "Hardening for GitHub-hosted runners",
    "Hardening for self-hosted runners",
    "Auditing GitHub Actions events",
    "Understanding dependencies in your workflows",
    "Being aware of security vulnerabilities in actions you use",
    "Keeping the actions in your workflows secure and up to date",
    "Protecting actions you&#x27;ve created",
    "Help and support",
    "Did you find what you needed?",
    "Help us make these docs great!",
    "Still need help?",
    "Legal"
  ],
  "redirect_hops": [
    "https://docs.github.com/en/actions/security-for-github-actions/security-guides/security-hardening-for-github-actions",
    "https://docs.github.com/en/actions/reference/security/secure-use"
  ],
  "storage_mode": "metadata-only",
  "body_stored": false,
  "trust": "untrusted-external-data"
}
