{
  "source_id": "govuk-user-research",
  "role": "product",
  "source_url": "https://www.gov.uk/service-manual/user-research",
  "final_url": "https://www.gov.uk/service-manual/user-research",
  "authority": "primary",
  "retrieved_at": "2026-08-19T06:47:24.614Z",
  "content_sha256": "9a33b097836c7172c31e21775789e7ce75332ad1953c9e56f6dc5d1b4d3623bf",
  "metadata_sha256": "97576d27c83a7485d6715af5ac00bf1baaae30503ce3a3117a19f97a50522aeb",
  "http_status": 200,
  "title": "User research - Service Manual - GOV.UK",
  "description": "Understand user needs: plan research, prepare for sessions, share and analyse findings.",
  "headings": [
    "Cookies on GOV.UK",
    "Navigation menu",
    "Services and information",
    "Government activity",
    "Search",
    "User research",
    "Understanding user research",
    "User research in the different design phases",
    "Preparing for user research",
    "User research methods",
    "Analysing and sharing findings",
    "Join the community",
    "Get notifications",
    "Is this page useful?",
    "Help us improve GOV.UK",
    "Help us improve GOV.UK",
    "Services and information",
    "Government activity",
    "Support links"
  ],
  "redirect_hops": [
    "https://www.gov.uk/service-manual/user-research"
  ],
  "storage_mode": "metadata-only",
  "body_stored": false,
  "trust": "untrusted-external-data"
}
