{
  "source_id": "govuk-user-stories",
  "role": "product",
  "source_url": "https://www.gov.uk/service-manual/agile-delivery/writing-user-stories",
  "final_url": "https://www.gov.uk/service-manual/agile-delivery/writing-user-stories",
  "authority": "primary",
  "retrieved_at": "2026-08-23T18:49:07.241Z",
  "content_sha256": "ad98632a17d1cfcf9a3c0ba86802ca4c7d21ce0d2732e0fe3fd5749282e7ca74",
  "metadata_sha256": "810b85ab3b3a3ec47470770715c64ce51f78e5251159187623c2b7dd4f390718",
  "http_status": 200,
  "title": "Writing user stories - Service Manual - GOV.UK",
  "description": "User stories record all the things a team has to do to build and run a service that meets user needs.",
  "headings": [
    "Cookies on GOV.UK",
    "Navigation menu",
    "Services and information",
    "Government activity",
    "Search",
    "Writing user stories",
    "Contents",
    "How to write a user story",
    "What to include",
    "The right format for user stories",
    "Focus on the goal",
    "Acceptance criteria",
    "Epics",
    "How to record user stories",
    "Planning with your user stories",
    "Related guides",
    "Updates to this page",
    "Is this page useful?",
    "Help us improve GOV.UK",
    "Help us improve GOV.UK",
    "Services and information",
    "Government activity",
    "Support links"
  ],
  "redirect_hops": [
    "https://www.gov.uk/service-manual/agile-delivery/writing-user-stories"
  ],
  "storage_mode": "metadata-only",
  "body_stored": false,
  "trust": "untrusted-external-data"
}
