{
  "source_id": "openai-api-docs",
  "role": "ai",
  "source_url": "https://developers.openai.com/api/docs/",
  "final_url": "https://developers.openai.com/api/docs",
  "authority": "primary",
  "retrieved_at": "2026-08-22T18:49:54.713Z",
  "content_sha256": "9841d3317b6e59c533ba87b82e5be4655c6e2794abdebeeb2f0453c13351d0ab",
  "metadata_sha256": "de5f8b0a0cea611a43a92487a11c19a511748ce632cc05260ff5663e4d9ce595",
  "http_status": 200,
  "title": "OpenAI API Platform Documentation",
  "description": "Explore guides, API docs, and examples for the OpenAI API.",
  "headings": [
    "Search the API docs",
    "Suggested",
    "Suggested",
    "Get started",
    "Core concepts",
    "SDKs and CLI",
    "Resources",
    "Legacy APIs",
    "Choose a model",
    "Text and code",
    "Prompting",
    "Reasoning",
    "Images and video",
    "Realtime and audio",
    "Specialized models",
    "Agents SDK",
    "ChatKit",
    "Search and retrieval",
    "Connect tools and data",
    "Build tool workflows",
    "Computer and code",
    "Media",
    "Get started",
    "Audio",
    "Connection methods",
    "Sessions and operations",
    "Go live",
    "Performance and quality",
    "Cost and throughput",
    "Safety and governance",
    "Infrastructure and access",
    "Operations",
    "Core concepts",
    "Plan",
    "Build",
    "Test and publish",
    "Conversion specs",
    "Guides",
    "Resources",
    "Get started"
  ],
  "redirect_hops": [
    "https://developers.openai.com/api/docs/",
    "https://developers.openai.com/api/docs"
  ],
  "storage_mode": "metadata-only",
  "body_stored": false,
  "trust": "untrusted-external-data"
}
