{
  "source_id": "github-actions-secrets",
  "role": "security",
  "source_url": "https://docs.github.com/actions/security-guides/using-secrets-in-github-actions",
  "final_url": "https://docs.github.com/en/actions/how-tos/write-workflows/choose-what-workflows-do/use-secrets",
  "authority": "primary",
  "retrieved_at": "2026-08-13T12:07:13.313Z",
  "content_sha256": "51681093620e11004c2c4c37370b1a664ef4655387e028084e2b82bf8078a0d3",
  "metadata_sha256": "7d89e53efad5d709cac708a711a682e6c7b0b0d6afcf5f396e1f23ad0aa3b62b",
  "http_status": 200,
  "title": "Using secrets in GitHub Actions - GitHub Docs",
  "description": "Learn how to create secrets at the repository, environment, and organization levels for GitHub Actions workflows.",
  "headings": [
    "GitHub Actions",
    "Using secrets in GitHub Actions",
    "Tool navigation",
    "In this article",
    "Creating secrets for a repository",
    "Creating secrets for an environment",
    "Creating secrets for an organization",
    "Reviewing access to organization-level secrets",
    "Using secrets in a workflow",
    "Example using Bash",
    "Example using PowerShell",
    "Example using Cmd.exe",
    "Storing large secrets",
    "Storing Base64 binary blobs as secrets",
    "Next steps",
    "Help and support",
    "Did you find what you needed?",
    "Help us make these docs great!",
    "Still need help?",
    "Legal"
  ],
  "redirect_hops": [
    "https://docs.github.com/actions/security-guides/using-secrets-in-github-actions",
    "https://docs.github.com/en/actions/how-tos/write-workflows/choose-what-workflows-do/use-secrets"
  ],
  "storage_mode": "metadata-only",
  "body_stored": false,
  "trust": "untrusted-external-data"
}
