{
  "source_id": "react-usememo",
  "role": "frontend",
  "source_url": "https://react.dev/reference/react/useMemo",
  "final_url": "https://react.dev/reference/react/useMemo",
  "authority": "primary",
  "retrieved_at": "2026-08-19T06:47:44.539Z",
  "content_sha256": "4dbf2e8df58eeb51a1fb979633a662c7a2addf6bd315f24eacf276600f5ec728",
  "metadata_sha256": "646e8ac829f7b77061d90e5c58db9af9cb6031873e66eaee4e67c5e674e9efc2",
  "http_status": 200,
  "title": "useMemo – React",
  "description": "",
  "headings": [
    "react@19.2",
    "react-dom@19.2",
    "React Compiler",
    "React DevTools",
    "eslint-plugin-react-hooks",
    "Rules of React",
    "React Server Components",
    "Legacy APIs",
    "useMemo",
    "Note",
    "Reference",
    "useMemo(calculateValue, dependencies)",
    "Note",
    "Usage",
    "Skipping expensive recalculations",
    "Note",
    "Skipping re-rendering of components",
    "Preventing an Effect from firing too often",
    "Memoizing a dependency of another Hook",
    "Memoizing a function",
    "Troubleshooting",
    "My calculation runs twice on every re-render",
    "My useMemo call is supposed to return an object, but returns undefined",
    "Every time my component renders, the calculation in useMemo re-runs",
    "I need to call useMemo for each list item in a loop, but it’s not allowed",
    "On this page"
  ],
  "redirect_hops": [
    "https://react.dev/reference/react/useMemo"
  ],
  "storage_mode": "metadata-only",
  "body_stored": false,
  "trust": "untrusted-external-data"
}
