{
  "source_id": "prisma-query-optimization",
  "role": "data",
  "source_url": "https://www.prisma.io/docs/orm/prisma-client/queries/advanced/query-optimization-performance",
  "final_url": "https://www.prisma.io/docs/orm/prisma-client/queries/advanced/query-optimization-performance",
  "authority": "primary",
  "retrieved_at": "2026-08-20T18:59:54.501Z",
  "content_sha256": "778a5207435521d18c9db206cbba2cb85c31bd39af699ffffcaeb83edadf7586",
  "metadata_sha256": "85ce880f49ecf33cbb0ad73b2c6114b194a8705e5f65d11c046783404cd2a02c",
  "http_status": 200,
  "title": "Query optimization | Prisma Documentation",
  "description": "How to identify and optimize query performance with Prisma",
  "headings": [
    "Query optimization",
    "Query Insights",
    "Enabling Prisma ORM attribution",
    "Debugging performance issues",
    "Using bulk queries",
    "Reuse PrismaClient or use connection pooling to avoid database connection pool exhaustion",
    "Solving the n+1 problem",
    "Using findUnique() with the fluent API",
    "Using JOINs with relationLoadStrategy",
    "Avoiding n+1 in loops",
    "On this page"
  ],
  "redirect_hops": [
    "https://www.prisma.io/docs/orm/prisma-client/queries/advanced/query-optimization-performance"
  ],
  "storage_mode": "metadata-only",
  "body_stored": false,
  "trust": "untrusted-external-data"
}
