{
  "source_id": "google-seo-starter",
  "role": "marketing",
  "source_url": "https://developers.google.com/search/docs/fundamentals/seo-starter-guide",
  "final_url": "https://developers.google.com/search/docs/fundamentals/seo-starter-guide?hl=pt-br",
  "authority": "primary",
  "retrieved_at": "2026-08-11T12:14:37.875Z",
  "content_sha256": "89769664bebf95629058c61f8072017dd5568cc837f1e59615d2360afd52fc39",
  "metadata_sha256": "07ec9dac89adeb673bb395fab75678c881f23682af506e0e012b41b9244058e3",
  "http_status": 200,
  "title": "Guia de SEO para iniciantes: princípios básicos | Central da Pesquisa Google &nbsp;|&nbsp; Documentation &nbsp;|&nbsp; Google for Developers",
  "description": "Conhecimentos básicos de SEO podem causar um impacto perceptível. Leia o Guia de SEO para iniciantes do Google para ter uma visão geral dos princípios básicos de otimização de mecanismos de pesquisa.",
  "headings": [
    "Guia de otimização de mecanismos de pesquisa (SEO) para iniciantes",
    "Como funciona a Pesquisa do Google?",
    "Quanto tempo leva para que eu veja o impacto nos resultados da pesquisa?",
    "Ajudar o Google a encontrar seu conteúdo",
    "Conferir se o Google pode ver sua página da mesma forma que um usuário",
    "Não quer ter uma página nos resultados da pesquisa do Google?",
    "Organizar seu site",
    "Usar URLs descritivos",
    "Agrupar páginas de tópicos semelhantes em diretórios",
    "Reduzir o conteúdo duplicado",
    "Deixar o site mais prático e interessante",
    "Antecipar os termos de pesquisa dos leitores",
    "Evitar anúncios que distraiam os usuários",
    "Criar links para recursos relevantes",
    "Influenciar a aparência do seu site na Pesquisa Google",
    "Influencie seus links de título",
    "Controlar os snippets",
    "Adicionar e otimizar imagens no seu site",
    "Adicionar imagens de alta qualidade perto do texto relevante",
    "Adicionar um texto alternativo descritivo à imagem",
    "Otimizar seus vídeos",
    "Promover seu site",
    "Dicas sobre o que evitar",
    "Próximas etapas",
    "Fique em dia com as informações e faça perguntas",
    "Receber suporte",
    "Recursos",
    "Ferramentas"
  ],
  "redirect_hops": [
    "https://developers.google.com/search/docs/fundamentals/seo-starter-guide",
    "https://developers.google.com/search/docs/fundamentals/seo-starter-guide?hl=pt-br"
  ],
  "storage_mode": "metadata-only",
  "body_stored": false,
  "trust": "untrusted-external-data"
}
