{
  "source_id": "prisma-docs",
  "role": "data",
  "source_url": "https://www.prisma.io/docs/orm",
  "final_url": "https://www.prisma.io/docs/orm",
  "authority": "primary",
  "retrieved_at": "2026-08-08T19:04:11.221Z",
  "content_sha256": "2919572f378101cdde13faadb4166827503ccef1075f22c485173c80e55f20c6",
  "metadata_sha256": "f688180f0d00ef2c2f30c263ff1999d2994d42f2bd59ffa6b45f5a184cf1be9b",
  "http_status": 200,
  "title": "What is Prisma ORM? (Overview) | Prisma Documentation",
  "description": "Prisma ORM is a next-generation Node.js and TypeScript ORM that provides type-safe database access, migrations, and a visual data editor.",
  "headings": [
    "Prisma ORM",
    "Get started",
    "Quickstart",
    "Add to an existing project",
    "Prisma Next docs",
    "Why Prisma ORM",
    "When to use Prisma",
    "How it works",
    "1. Define your schema",
    "2. Configure your connection",
    "3. Run migrations",
    "4. Query with Prisma Client",
    "Next steps",
    "On this page"
  ],
  "redirect_hops": [
    "https://www.prisma.io/docs/orm"
  ],
  "storage_mode": "metadata-only",
  "body_stored": false,
  "trust": "untrusted-external-data"
}
