{
  "source_id": "nextauth-v4",
  "role": "backend",
  "source_url": "https://next-auth.js.org/",
  "final_url": "https://next-auth.js.org/",
  "authority": "primary",
  "retrieved_at": "2026-08-11T19:22:04.660Z",
  "content_sha256": "07bcf83328253f1a6f72fd768ca5965c86667160dfc1c5a470a3e1181ed8d466",
  "metadata_sha256": "7ef826429aeb83e4756816caa8c512e60adb7dee9df76038f89e8ce62329809e",
  "http_status": 200,
  "title": "NextAuth.js",
  "description": "Authentication for Next.js",
  "headings": [
    "NextAuth.js",
    "Open Source. Full Stack. Own Your Data.",
    "Easy",
    "Flexible",
    "Secure",
    "Add authentication in minutes!"
  ],
  "redirect_hops": [
    "https://next-auth.js.org/"
  ],
  "storage_mode": "metadata-only",
  "body_stored": false,
  "trust": "untrusted-external-data"
}
