{
  "source_id": "openai-codex-docs",
  "role": "ai",
  "source_url": "https://developers.openai.com/codex/",
  "final_url": "https://learn.chatgpt.com/docs",
  "authority": "primary",
  "retrieved_at": "2026-08-19T06:47:34.391Z",
  "content_sha256": "aebfefdf93e5ddf7101b5d5ce403857684e35e76e004c99459545ba117e30381",
  "metadata_sha256": "db22460c450bce73b1afa575ec6c6f45b333718bf0d137fa7e8aba4fe29e3e0c",
  "http_status": 200,
  "title": "ChatGPT | ChatGPT Learn",
  "description": "Use ChatGPT for ambitious work and software development",
  "headings": [
    "Search the docs",
    "Suggested",
    "Suggested",
    "Get started",
    "Core concepts",
    "SDKs and CLI",
    "Resources",
    "Legacy APIs",
    "Choose a model",
    "Text and code",
    "Prompting",
    "Reasoning",
    "Images and video",
    "Realtime and audio",
    "Specialized models",
    "Agents SDK",
    "ChatKit",
    "Search and retrieval",
    "Connect tools and data",
    "Build tool workflows",
    "Computer and code",
    "Media",
    "Get started",
    "Audio",
    "Connection methods",
    "Sessions and operations",
    "Go live",
    "Performance and quality",
    "Cost and throughput",
    "Safety and governance",
    "Infrastructure and access",
    "Operations",
    "Core concepts",
    "Plan",
    "Build",
    "Test and publish",
    "Conversion specs",
    "Guides",
    "Resources",
    "Get started"
  ],
  "redirect_hops": [
    "https://developers.openai.com/codex/",
    "https://developers.openai.com/codex",
    "https://learn.chatgpt.com/docs"
  ],
  "storage_mode": "metadata-only",
  "body_stored": false,
  "trust": "untrusted-external-data"
}
